{
  "$schema": "../schemas/update.schema.json",
  "id": "U-20260901-015",
  "title": "2026학년도 6월 고2 24·29번 10단계 워크북 신규 등록",
  "date": "2026-09-01",
  "summary": "제공된 2026학년도 6월 고2 전국연합학력평가 PDF의 24번과 29번 지문을 각각 단일 canonical 정본으로 전사하고 학생용·해설용 10단계 워크북을 생성합니다.",
  "category": "new-content",
  "applyTo": "selected",
  "selectedWorkbooks": [
    "2026-june-grade2-q24",
    "2026-june-grade2-q29"
  ],
  "affectedStages": [
    1,
    2,
    3,
    4,
    5,
    6,
    7,
    8,
    9,
    10
  ],
  "request": "고2 6월 원본 PDF의 24, 29번으로 작업을 시작합니다.",
  "directChanges": {
    "files": [
      "config/versions.json",
      "updates/U-20260901-015.json",
      "workbooks/2026-june-grade2-q24/content.json",
      "workbooks/2026-june-grade2-q29/content.json"
    ],
    "jsonPaths": [
      {
        "manifest": "canonical",
        "path": "$"
      }
    ]
  },
  "verification": [
    {
      "name": "source-transcription",
      "status": "pass",
      "details": "원본 PDF 3쪽의 24번과 5쪽의 29번을 고해상도로 렌더링해 본문 단어, 대소문자, 숫자, 문장부호와 밑줄 선택지를 시각 확인했습니다."
    },
    {
      "name": "source-question-cross-check",
      "status": "pass",
      "details": "24번 제목 문항의 정답 ④와 29번 어법 문항의 정답 ②를 지문 전체 의미·구조 검토에 교차 사용했습니다. 29번의 출제 오류형 producing은 보고서에 남기고 canonical 학습 본문은 정답형 produced로 정규화했습니다."
    },
    {
      "name": "semantic-review",
      "status": "pass",
      "details": "완성 번역, 직독직해 영한 1:1 대응, 서술어, 어휘, 동사 cue, 오답과 배열 복원을 문장별로 검토했습니다."
    },
    {
      "name": "release-validation",
      "status": "pass",
      "details": "두 canonical의 스키마·구조 검증, 전체 38개 단위 테스트, 브라우저 QA, 학생용 정답 0개, 답지 공유 target 일치, PDF 쪽수 및 대표 페이지 시각 검수를 완료했습니다."
    }
  ]
}
