{
  "$schema": "../schemas/update.schema.json",
  "id": "U-20260710-001",
  "title": "저비용 단일 정본 워크북 엔진 전면 재구축",
  "date": "2026-07-10",
  "summary": "기존 콘텐츠와 확정 디자인을 보존하면서 중복 HTML·반복 프롬프트·정규식 정답 추측을 제거하고, canonical 정본에서 학생용과 해설용을 함께 생성·검증·릴리스하는 구조로 전환합니다.",
  "category": "architecture",
  "applyTo": "all",
  "affectedStages": [1, 2, 3, 4, 5, 6, 7, 8, 9, 10],
  "request": [
    "기존 콘텐츠는 유지하되 전체 작업 구조를 처음부터 다시 구성합니다.",
    "최초 출력부터 제품 수준이어야 하며 검증 전 결과는 공개하지 않습니다.",
    "업데이트를 쉽게 추가하고 변경 위치를 Markdown 보고서로 남깁니다.",
    "AGENTS.md·HTML·Python 반복 컨텍스트를 줄이면서 현재 품질을 유지합니다."
  ],
  "directChanges": {
    "files": [
      "AGENTS.md",
      "index.html",
      "answer-template.html",
      "config/versions.json",
      "config/workbook-spec.json",
      "docs/semantic-rubric.md",
      "schemas/canonical-workbook.schema.json",
      "schemas/update.schema.json",
      "workbooks/chocolate/content.json",
      "workbook_engine/compiler.py",
      "workbook_engine/__main__.py",
      "workbook_engine/migrate_legacy.py",
      "workbook_engine/paginator.py",
      "workbook_engine/validator.py",
      "workbook_engine/textops.py",
      "workbook_engine/render.py",
      "workbook_engine/qa.py",
      "workbook_engine/release.py",
      "workbook_engine/schema_gate.py",
      "workbook_engine/change_report.py",
      "workbook_engine/manifest.py",
      "workbook_engine/templates/shell.html",
      "workbook_engine/templates/workbook.css",
      "workbook_engine/templates/renderer.js",
      "workbook_engine/templates/preview-data.js",
      "workbook_engine/templates/README.md",
      "tests/test_engine.py",
      "tests/test_render_contract.py",
      "tests/test_release_safety.py",
      "/Users/apple/.codex/skills/workbook-release/SKILL.md"
    ],
    "jsonPaths": [
      {"manifest": "canonical", "path": "$"},
      {"manifest": "spec", "path": "$"},
      {"manifest": "template", "path": "$"}
    ]
  },
  "verification": [
    {
      "name": "canonical-and-compiled-validation",
      "status": "pass",
      "details": "원문 복원, 타깃 해석, 10단계 전체 문장 커버리지와 학생용 정답 비노출을 검사합니다."
    },
    {
      "name": "browser-and-pdf-validation",
      "status": "pass",
      "details": "CDP 완료 상태, 페이지 넘침, 학생·해설 공통 슬롯, A4 PDF 페이지 수를 검사합니다."
    },
    {
      "name": "representative-visual-review",
      "status": "pass",
      "details": "첫쪽·part 전환·중간 위험 단계·7단계·9단계·마지막 쪽을 학생용과 해설용에서 확인합니다."
    }
  ]
}
