{
  "$schema": "../schemas/update.schema.json",
  "id": "U-20260826-011",
  "title": "해설 답안 글자만 제거한 문제본",
  "date": "2026-08-26",
  "summary": "해설용 작성 문항의 박스와 답안 공간을 그대로 유지하고, 학생용에서는 답 글자만 제거해 별도의 작성선 없이 빈 공간으로 제공합니다.",
  "category": "layout-and-release",
  "applyTo": "all",
  "affectedStages": [
    4,
    8,
    10
  ],
  "request": "해설 문항을 그대로 복제한 뒤 빨간 답 글자만 지우고, 그 자리에 새 밑줄을 만들지 않은 문제본을 생성합니다.",
  "directChanges": {
    "files": [
      "config/workbook-spec.json",
      "config/versions.json",
      "workbook_engine/templates/README.md",
      "workbook_engine/templates/workbook.css",
      "updates/U-20260826-011.json",
      "workbooks/2026-june-grade2-q20/content.json",
      "workbooks/2026-june-grade2-q21/content.json",
      "workbooks/chocolate/content.json",
      "workbooks/soccer-jersey-swap/content.json",
      "workbooks/when-failure-become-ideas/content.json"
    ],
    "jsonPaths": [
      {
        "manifest": "spec",
        "path": "$"
      },
      {
        "manifest": "template",
        "path": "$"
      },
      {
        "manifest": "build",
        "path": "$"
      },
      {
        "manifest": "canonical",
        "path": "$"
      }
    ]
  },
  "verification": [
    {
      "name": "answer-only-text-removal",
      "status": "pass",
      "details": "학생용은 해설 답안 줄의 측정 형상을 보존하되 답 글자와 대체 작성선을 모두 표시하지 않습니다."
    },
    {
      "name": "student-answer-geometry-match",
      "status": "pass",
      "details": "브라우저가 답 글자를 제거한 학생용 빈 공간과 해설 답안의 줄별 위치·가로 길이·높이를 비교합니다."
    },
    {
      "name": "regression-suite",
      "status": "pass",
      "details": "정본 5개 검증과 전체 회귀 검사 33개가 통과했습니다."
    }
  ]
}
