{
  "$schema": "../schemas/update.schema.json",
  "id": "U-20260723-004",
  "title": "8단계 조각형 정답 밑줄 제거",
  "date": "2026-07-23",
  "summary": "8단계 순서 배열하기에서 제시어 개수에 맞춘 짧은 정답 밑줄을 제거하고, 우리말·제시어·긴 답안 작성선만 유지합니다.",
  "category": "shared-layout",
  "applyTo": "all",
  "affectedStages": [
    8
  ],
  "request": "첨부 화면에 표시된 8단계의 조각형 정답 밑줄을 제거하고 AGENTS.md, HTML 파생물, Python 생성 엔진을 모두 일치시킵니다.",
  "directChanges": {
    "files": [
      "AGENTS.md",
      "config/versions.json",
      "config/workbook-spec.json",
      "tests/test_engine.py",
      "updates/U-20260723-004.json",
      "workbook_engine/__init__.py",
      "workbook_engine/compiler.py",
      "workbook_engine/templates/README.md",
      "workbook_engine/templates/preview-data.js",
      "workbooks/chocolate/content.json",
      "workbooks/soccer-jersey-swap/content.json",
      "workbooks/when-failure-become-ideas/content.json"
    ],
    "jsonPaths": [
      {
        "manifest": "canonical",
        "path": "$"
      },
      {
        "manifest": "spec",
        "path": "$"
      },
      {
        "manifest": "build",
        "path": "$"
      }
    ]
  },
  "verification": [
    {
      "name": "stage8-arrangement-slots",
      "status": "pass",
      "details": "8단계 compiled item에 조각형 en/arrange-slot을 생성하지 않고 완성 문장 responseTargetId 하나만 생성하도록 계약 테스트를 추가했습니다."
    },
    {
      "name": "release-validation",
      "status": "skipped",
      "details": "공유 엔진 테스트와 새 비공개 빌드에서 확인합니다."
    }
  ]
}
